{
  "schemaVersion": 1,
  "releaseId": "putnam-2020-2025-v0.4.0",
  "contentSchemaVersion": 3,
  "contentVersion": "putnam-2020-2025.1",
  "appVersionName": "0.4.0",
  "appVersionCode": 4,
  "includedSets": [
    "putnam/2020",
    "putnam/2021",
    "putnam/2022",
    "putnam/2023",
    "putnam/2024",
    "putnam/2025"
  ]
}
